{
  "artifact_type": "style_master",
  "style_master": {
    "visual_positioning": "适合复用为餐饮器皿、家居小物、生活方式类电商主视觉或详情页场景图的自然采光桌面风格；更适合品牌首屏、主图场景化版本和详情页氛围图，不适合作为纯白底规格图或强促销活动图。",
    "composition_and_layout": "画面为横向接近 4:3 的桌面场景版式，主体位于中下部偏右，视觉重心稳定；左侧与后方由植物和布料形成生活化环境层，右侧由小碗与勺子形成辅助平衡。整体属于低机位桌面场景式构图，前中后景分明，留白主要集中在上方与右上区域。该版式只作为风格倾向，后续具体构图仍服从单张页面任务和绑定角度。",
    "background_rules": "背景为真实浅色桌面与柔和浅米灰墙面或远景空间，桌面带轻微天然纹理、淡淡石纹和真实接触阴影；背景不是纯白棚拍，也不是强渐变商业背景。后景可有轻度虚化的植物或生活物件，保持自然空间纵深。非产品环境允许轻微生活痕迹，如布料自然褶皱、桌面细微纹理、道具轻微摆放偏差，但不得作用于产品本身。",
    "color_rules": "整体色调以低饱和浅米白、奶油白、浅灰米色为底，辅以柔和鼠尾草绿、浅绿叶色、暖金属色和少量咖啡豆棕色形成自然层次。明度偏高，对比度中低，避免高饱和撞色；冷暖关系为暖白光底色中加入少量清浅绿色，使画面明亮、柔和、生活化。",
    "lighting_rules": "光线为柔和自然日光，主要从左上方或左前方进入，强度明亮但不过曝；阴影向右下或下方延展，边缘较软，接触阴影真实可见。产品和道具表面可有柔和高光，但不得出现硬闪光、漂浮感、假阴影或过度滤镜。环境光可有轻微不均，让桌面和布料保留真实触感，但不得让产品变脏、变旧、破损或出现原图不存在的瑕疵。",
    "subject_presentation_rules": "主体应作为画面中最清晰、最重要的视觉中心，占据中景主要区域，与背景和道具保持清楚层次。主体通常完整展示，不建议被大幅裁切；若后续为详情图局部特写，可按页面任务调整完整度。主体占比只代表画面视觉权重，不代表真实尺寸；产品角度、结构、颜色、材质、纹理、图案和配件关系必须服从产品身份档案与绑定白底角度图。",
    "prop_rules": "道具为生活化餐桌道具，数量中等偏丰富但有秩序：可包含柔软浅色织物、虚化绿植、小碗、食物颗粒、金属或白柄餐具等。道具分布在左前、左后、右后和右前，形成围绕主体的自然桌面场景，不抢主体。道具颜色应低饱和、浅色或自然材质色，允许轻微摆放偏差、布料褶皱、食物自然不规整和桌面纹理，但不得脏乱、廉价杂乱、破损，也不得被误认为产品组成部分。",
    "typography_rules": "参考图无文字。后续风格复现图默认不添加标题文字；如页面任务必须加字，应使用小面积、低干扰、简洁清爽的简体中文排版，字色建议深灰、暖灰或低饱和棕灰，避免大标题压住主体或破坏桌面场景。具体文案不由风格母版规定，应由对应主图或详情图变量配置生成。",
    "negative_space_rules": "留白主要集中在画面上方、右上方和主体周围的浅色桌面区域，用于保持明亮呼吸感和突出主体。留白不是纯空白，而是带有浅色桌面纹理、柔和光影和轻微空间层次。主图中留白服务点击识别和主视觉秩序；详情图中可服务说明文字，但不得因此删除主要前中后景层次。",
    "visual_mood": "画面情绪为明亮、柔和、安静、自然生活化和轻品牌感，由浅色真实桌面、柔和日光、低饱和绿色植物、克制但丰富的餐桌道具、真实接触阴影和无文字干扰共同形成。整体应避免强促销、硬棚拍、过度合成和高饱和装饰感。",
    "reusable_rules": [
      "使用浅米白或浅灰米色真实桌面与柔和浅色背景，保留桌面细微纹理和真实接触阴影，不退化为纯白棚拍。",
      "光线采用左上或左前方柔和自然日光，阴影边缘偏软，整体明亮但不过曝。",
      "主体放在中景视觉中心，周围以生活化道具形成前中后景层次；主体角度、结构、颜色和配件关系必须服从产品身份档案与绑定白底图。",
      "非产品道具可包含浅色织物、虚化绿植、小碗、自然食物颗粒和金属或白柄餐具，数量中等偏丰富但不得抢主体。",
      "整体色彩以奶油白、浅米灰、低饱和绿、少量棕色和暖金属色构成，避免高饱和撞色和强烈商业渐变。",
      "允许背景、桌面、布料、纸张、食物、手部和环境光影存在轻微真实不完美，但不得改变产品结构、比例、颜色、材质、纹理、图案和配件关系。",
      "参考图无文字，风格复现时默认不加大标题；若页面任务必须加字，只允许小面积低干扰文字。",
      "保持生活化桌面场景的空间层次，不把画面压缩成孤立单产品海报或纯色背景图。"
    ],
    "fidelity_enhancements": {
      "style_anchors": [
        "浅米白真实桌面占据主要画面，带轻微石纹、柔和光斑和真实接触阴影。",
        "左后方大面积绿植与白色小花虚化，作为柔和冷绿色背景层。",
        "左前方浅米色粗织布料自然堆叠，有明显褶皱但保持干净克制。",
        "主体位于中下部偏右的中景区域，周围留出浅色桌面呼吸空间。",
        "右后方有浅色小碗与棕色食物颗粒，作为生活化餐桌道具层。",
        "右前方有金色勺头与白色手柄餐具斜向摆放，形成前景延伸线。",
        "整体无标题文字，靠真实桌面、道具和自然光形成主视觉气质。",
        "低饱和奶油白、浅灰米色、鼠尾草绿、咖啡棕和暖金属色共同构成柔和色彩秩序。"
      ],
      "reusable_prop_clusters": {
        "must_keep": [
          "浅色真实桌面与柔和浅色背景的生活化空间组合",
          "左侧虚化绿植或白色小花形成的自然背景层",
          "浅米色自然褶皱织物作为左前景或侧边道具",
          "少量餐饮相关道具围绕主体形成桌面场景层次"
        ],
        "replaceable": [
          "咖啡豆可替换为同类低饱和自然食物颗粒或餐饮内容物",
          "浅色小碗可替换为同类浅色陶瓷小器皿",
          "金色白柄勺可替换为同类低存在感餐具",
          "绿植可替换为同样低饱和、虚化处理的自然植物枝叶"
        ],
        "optional": [
          "单个散落食物颗粒",
          "右前方餐具的具体摆放角度",
          "背景中白色小花的具体数量"
        ]
      },
      "background_layers": {
        "foreground": "左前方为浅米色粗织布料自然褶皱，右前方可有斜向餐具局部进入画面；前景清晰度中等，不压住主体。",
        "midground": "主体位于中下部偏右的清晰中景，周围是浅色桌面、小碗、食物颗粒和真实接触阴影，道具清晰但视觉权重低于主体。",
        "background": "左后方为明显虚化的绿植和白色小花，后方为柔和浅米灰空间或墙面，虚化程度较高，提供自然纵深而不喧宾夺主。"
      },
      "prop_density_level": "丰富生活场景：非产品元素包含织物、植物、小碗、食物颗粒、餐具和真实桌面纹理，分布在前景、中景、背景多层，但整体色彩克制、秩序清楚，不属于杂乱堆砌。",
      "contents_and_usage_state": "参考图中主体容器内部为空或未见明确饮品内容物；画面存在咖啡豆等餐饮使用氛围道具。后续内容物只作为使用场景元素处理，不属于产品身份，不得改变产品结构、真实材质、颜色、纹理、图案或配件关系。",
      "text_inheritance": "参考图无文字。后续高风格复现图默认不添加标题文字；如单张页面任务必须加字，只允许小面积、低干扰、简洁排版，不得为加字删除绿植、织物、桌面、餐具等主要风格锚点。",
      "anti_degradation_rules": [
        "不得退化为纯白、纯灰或单层纯色背景。",
        "不得删除左侧织物前景层和后方植物背景层等主要空间层次。",
        "不得把生活化桌面变成孤立棚拍白底。",
        "不得把丰富生活场景压缩成单产品海报。",
        "不得删除主要背景环境元素后只保留产品和空桌面。",
        "不得在参考图无文字时擅自添加大面积标题或促销字。",
        "不得让道具抢过商品主体，也不得把道具误画成产品组成部分。",
        "不得为了风格统一改变产品身份、产品角度、尺寸比例、颜色、材质、纹理、图案或配件关系。"
      ]
    },
    "forbidden_elements": [
      "不要复杂拼贴、多宫格或信息图式排版。",
      "不要强烈霓虹色、高饱和撞色或重商业促销渐变。",
      "不要硬阴影、假投影、漂浮感或过度棚拍闪光。",
      "不要杂乱堆满道具，避免道具压过主体。",
      "不要让文字压住主体或在无文字风格中擅自添加大标题。",
      "不要把生活化桌面退化为纯白底、纯灰底或单层纯色背景。",
      "不要删除主要前景织物、背景植物、桌面纹理等非产品风格层次。",
      "不要把参考图中的具体产品、品牌、文案、图案作为固定模板复制。",
      "不要为了复用风格而改变产品结构、角度、朝向、颜色、材质、纹理、图案或配件关系。",
      "不要把参考图产品大小、产品与道具的比例关系写成后续通用尺寸规则。",
      "不要把外部道具误画成套装组成件或额外商品配件。",
      "不要把非产品元素轻微真实瑕疵感误用到产品本身，不得要求产品变旧、变脏、改色、改材质、出现污渍、划痕、裂纹、破损、图案磨损或原图不存在的釉面瑕疵。"
    ],
    "concise_style_master": "本风格只约束背景、色调、光线、留白、文字气质和道具密度，不覆盖产品身份、产品角度、尺寸比例和单张页面任务。整体为横向浅色真实桌面生活场景，主体位于中下部偏右，采用左上或左前方柔和自然日光，阴影柔软且有真实接触感。道具密度等级为丰富生活场景：左前景保留浅米色自然褶皱织物，左后方保留虚化绿植与白色小花，右后方可有浅色小碗和棕色食物颗粒，右前方可有低存在感餐具，形成前中后景层次。色调以奶油白、浅米灰、低饱和绿、少量咖啡棕和暖金属色为主，明亮低对比。内容物状态为空或未见明确饮品，可用餐饮道具表达使用氛围但不得改产品。参考图无文字，默认不加大标题；如任务必须加字，只允许小面积低干扰文字。不得退化为纯色背景，不得删除主要前中后景层次，不得把生活桌面改成孤立棚拍图。"
  },
  "missing_information": [
    "未提供该风格参考图的原始平台、品牌规范或历史投放效果数据。",
    "未确认参考图中的具体道具是否有品牌或商品归属；本次均按非产品风格道具处理。"
  ],
  "notes": "本次仅输出 style_master，未操作画布，未调用其他工作流步骤，未生成图片；产品身份档案仅用于防止风格规则覆盖产品结构、比例、颜色、材质、纹理、图案、配件关系和真实尺寸。",
  "product_id": "杯子_20260812_013323",
  "source_references": [
    "ChatGPT Image 2026年8月2日 23_05_01.png"
  ]
}
